{
	"$schema": "https://agentuity.dev/schema/cli/v1/agentuity.json",
	"projectId": "proj_28be46e57262a19acdccf29a3154835d",
	"orgId": "org_2u8RgDTwcZWrZrZ3sZh24T5FCtz",
	"deployment": {
		"resources": {
			"memory": "2Gi",
			"cpu": "2",
			"disk": "4Gi"
		},
		"domains": ["v2.agentuity.dev"]
	},
	"build": {
		"timeout": "45m",
		"resources": {
			"memory": "16Gi",
			"cpu": "4",
			"disk": "20Gi"
		}
	},
	"region": "use"
}
