{
  "$schema": "https://agentuity.dev/schema/cli/v1/agentuity.json",
  "projectId": "proj_796602fdc85ccde2da7530a809b8a440",
  "orgId": "org_38GAeCRXBdW3KqNPi4WRm957Xia",
  "region": "local",
  "deployment": {
    "resources": {
      "memory": "500Mi",
      "cpu": "500m",
      "disk": "500Mi"
    },
    "domains": []
  }
}
